[
  {
    "id": "de-0031", "language": "de", "base_language": "en",
    "word": "Frage", "article": "die", "translation": "question",
    "category": "noun", "frequency_rank": 31, "cefr_level": "A1", "reviewed": false,
    "sentences": ["Ich habe eine Frage.", "Das ist eine gute Frage.", "Er beantwortet die Frage nicht."],
    "sentence_translations": ["I have a question.", "That is a good question.", "He doesn't answer the question."],
    "noun_info": { "plural": "Fragen", "gender": "feminine" }
  },
  {
    "id": "de-0032", "language": "de", "base_language": "en",
    "word": "Arbeit", "article": "die", "translation": "work",
    "category": "noun", "frequency_rank": 32, "cefr_level": "A1", "reviewed": false,
    "sentences": ["Die Arbeit macht mir Spaß.", "Ich gehe zur Arbeit.", "Sie hat viel Arbeit heute."],
    "sentence_translations": ["I enjoy the work.", "I am going to work.", "She has a lot of work today."],
    "noun_info": { "plural": "Arbeiten", "gender": "feminine" }
  },
  {
    "id": "de-0033", "language": "de", "base_language": "en",
    "word": "Auto", "article": "das", "translation": "car",
    "category": "noun", "frequency_rank": 33, "cefr_level": "A1", "reviewed": false,
    "sentences": ["Das Auto ist neu.", "Wir fahren mit dem Auto.", "Sein Auto ist rot."],
    "sentence_translations": ["The car is new.", "We are driving by car.", "His car is red."],
    "noun_info": { "plural": "Autos", "gender": "neuter" }
  },
  {
    "id": "de-0034", "language": "de", "base_language": "en",
    "word": "Schule", "article": "die", "translation": "school",
    "category": "noun", "frequency_rank": 34, "cefr_level": "A1", "reviewed": false,
    "sentences": ["Die Schule beginnt um acht Uhr.", "Mein Sohn geht in die Schule.", "Die Schule ist nicht weit von hier."],
    "sentence_translations": ["School starts at eight o'clock.", "My son goes to school.", "The school is not far from here."],
    "noun_info": { "plural": "Schulen", "gender": "feminine" }
  },
  {
    "id": "de-0035", "language": "de", "base_language": "en",
    "word": "Buch", "article": "das", "translation": "book",
    "category": "noun", "frequency_rank": 35, "cefr_level": "A1", "reviewed": false,
    "sentences": ["Ich lese ein spannendes Buch.", "Das Buch liegt auf dem Tisch.", "Sie schreibt ein neues Buch."],
    "sentence_translations": ["I am reading an exciting book.", "The book is on the table.", "She is writing a new book."],
    "noun_info": { "plural": "Bücher", "gender": "neuter" }
  },
  {
    "id": "de-0036", "language": "de", "base_language": "en",
    "word": "Freund", "article": "der", "translation": "friend",
    "category": "noun", "frequency_rank": 36, "cefr_level": "A1", "reviewed": false,
    "sentences": ["Er ist mein bester Freund.", "Ich treffe meinen Freund heute.", "Sie hat viele Freunde."],
    "sentence_translations": ["He is my best friend.", "I am meeting my friend today.", "She has many friends."],
    "noun_info": { "plural": "Freunde", "gender": "masculine" }
  },
  {
    "id": "de-0037", "language": "de", "base_language": "en",
    "word": "Familie", "article": "die", "translation": "family",
    "category": "noun", "frequency_rank": 37, "cefr_level": "A1", "reviewed": false,
    "sentences": ["Meine Familie ist groß.", "Ich besuche meine Familie am Wochenende.", "Die Familie wohnt in München."],
    "sentence_translations": ["My family is big.", "I visit my family on the weekend.", "The family lives in Munich."],
    "noun_info": { "plural": "Familien", "gender": "feminine" }
  },
  {
    "id": "de-0038", "language": "de", "base_language": "en",
    "word": "Geld", "article": "das", "translation": "money",
    "category": "noun", "frequency_rank": 38, "cefr_level": "A1", "reviewed": false,
    "sentences": ["Ich brauche mehr Geld.", "Er hat kein Geld dabei.", "Wir sparen Geld für den Urlaub."],
    "sentence_translations": ["I need more money.", "He doesn't have any money with him.", "We are saving money for the vacation."],
    "noun_info": { "plural": "Gelder", "gender": "neuter" }
  },
  {
    "id": "de-0039", "language": "de", "base_language": "en",
    "word": "Stunde", "article": "die", "translation": "hour",
    "category": "noun", "frequency_rank": 39, "cefr_level": "A1", "reviewed": false,
    "sentences": ["Die Reise dauert eine Stunde.", "Ich warte seit einer Stunde.", "Wir haben noch eine Stunde Zeit."],
    "sentence_translations": ["The trip takes one hour.", "I have been waiting for an hour.", "We still have one hour left."],
    "noun_info": { "plural": "Stunden", "gender": "feminine" }
  },
  {
    "id": "de-0040", "language": "de", "base_language": "en",
    "word": "Woche", "article": "die", "translation": "week",
    "category": "noun", "frequency_rank": 40, "cefr_level": "A1", "reviewed": false,
    "sentences": ["Diese Woche bin ich krank.", "Ich sehe ihn einmal pro Woche.", "Die Woche hat sieben Tage."],
    "sentence_translations": ["This week I am sick.", "I see him once a week.", "The week has seven days."],
    "noun_info": { "plural": "Wochen", "gender": "feminine" }
  },
  {
    "id": "de-0041", "language": "de", "base_language": "en",
    "word": "essen", "article": null, "translation": "to eat",
    "category": "verb", "frequency_rank": 41, "cefr_level": "A1", "reviewed": false,
    "sentences": ["Ich esse gern Pizza.", "Isst du Fleisch?", "Wir essen um sieben Uhr."],
    "sentence_translations": ["I like to eat pizza.", "Do you eat meat?", "We eat at seven o'clock."],
    "verb_info": {
      "perfect_form": "hat gegessen", "auxiliary": "haben", "separable": false, "separable_prefix": null,
      "present_tense": { "ich": "esse", "du": "isst", "er_sie_es": "isst", "wir": "essen", "ihr": "esst", "sie_Sie": "essen" }
    }
  },
  {
    "id": "de-0042", "language": "de", "base_language": "en",
    "word": "trinken", "article": null, "translation": "to drink",
    "category": "verb", "frequency_rank": 42, "cefr_level": "A1", "reviewed": false,
    "sentences": ["Ich trinke Wasser.", "Was trinkst du gern?", "Sie trinkt jeden Morgen Kaffee."],
    "sentence_translations": ["I drink water.", "What do you like to drink?", "She drinks coffee every morning."],
    "verb_info": {
      "perfect_form": "hat getrunken", "auxiliary": "haben", "separable": false, "separable_prefix": null,
      "present_tense": { "ich": "trinke", "du": "trinkst", "er_sie_es": "trinkt", "wir": "trinken", "ihr": "trinkt", "sie_Sie": "trinken" }
    }
  },
  {
    "id": "de-0043", "language": "de", "base_language": "en",
    "word": "sprechen", "article": null, "translation": "to speak",
    "category": "verb", "frequency_rank": 43, "cefr_level": "A1", "reviewed": false,
    "sentences": ["Ich spreche Deutsch.", "Sprichst du Englisch?", "Wir sprechen über das Wetter."],
    "sentence_translations": ["I speak German.", "Do you speak English?", "We are talking about the weather."],
    "verb_info": {
      "perfect_form": "hat gesprochen", "auxiliary": "haben", "separable": false, "separable_prefix": null,
      "present_tense": { "ich": "spreche", "du": "sprichst", "er_sie_es": "spricht", "wir": "sprechen", "ihr": "sprecht", "sie_Sie": "sprechen" }
    }
  },
  {
    "id": "de-0044", "language": "de", "base_language": "en",
    "word": "arbeiten", "article": null, "translation": "to work",
    "category": "verb", "frequency_rank": 44, "cefr_level": "A1", "reviewed": false,
    "sentences": ["Ich arbeite bei einer Bank.", "Er arbeitet viel.", "Wir arbeiten heute nicht."],
    "sentence_translations": ["I work at a bank.", "He works a lot.", "We are not working today."],
    "verb_info": {
      "perfect_form": "hat gearbeitet", "auxiliary": "haben", "separable": false, "separable_prefix": null,
      "present_tense": { "ich": "arbeite", "du": "arbeitest", "er_sie_es": "arbeitet", "wir": "arbeiten", "ihr": "arbeitet", "sie_Sie": "arbeiten" }
    }
  },
  {
    "id": "de-0045", "language": "de", "base_language": "en",
    "word": "lernen", "article": null, "translation": "to learn",
    "category": "verb", "frequency_rank": 45, "cefr_level": "A1", "reviewed": false,
    "sentences": ["Ich lerne Deutsch.", "Sie lernt schnell.", "Wir lernen jeden Tag neue Wörter."],
    "sentence_translations": ["I am learning German.", "She learns quickly.", "We learn new words every day."],
    "verb_info": {
      "perfect_form": "hat gelernt", "auxiliary": "haben", "separable": false, "separable_prefix": null,
      "present_tense": { "ich": "lerne", "du": "lernst", "er_sie_es": "lernt", "wir": "lernen", "ihr": "lernt", "sie_Sie": "lernen" }
    }
  },
  {
    "id": "de-0046", "language": "de", "base_language": "en",
    "word": "spielen", "article": null, "translation": "to play",
    "category": "verb", "frequency_rank": 46, "cefr_level": "A1", "reviewed": false,
    "sentences": ["Die Kinder spielen im Park.", "Ich spiele gern Fußball.", "Sie spielt Klavier."],
    "sentence_translations": ["The children are playing in the park.", "I like to play soccer.", "She plays the piano."],
    "verb_info": {
      "perfect_form": "hat gespielt", "auxiliary": "haben", "separable": false, "separable_prefix": null,
      "present_tense": { "ich": "spiele", "du": "spielst", "er_sie_es": "spielt", "wir": "spielen", "ihr": "spielt", "sie_Sie": "spielen" }
    }
  },
  {
    "id": "de-0047", "language": "de", "base_language": "en",
    "word": "kaufen", "article": null, "translation": "to buy",
    "category": "verb", "frequency_rank": 47, "cefr_level": "A1", "reviewed": false,
    "sentences": ["Ich kaufe Brot.", "Was kaufst du im Supermarkt?", "Wir kaufen ein neues Auto."],
    "sentence_translations": ["I am buying bread.", "What are you buying at the supermarket?", "We are buying a new car."],
    "verb_info": {
      "perfect_form": "hat gekauft", "auxiliary": "haben", "separable": false, "separable_prefix": null,